Username,Tweet URL,Tweet Text,Translated Text
elonmusk,https://twitter.com/elonmusk/status/1641328839144927232,"Old joke about agnostic technologists building artificial super intelligence to find out if there’s a God.

They finally finish &amp; ask the question.

AI replies: “There is now, mfs!!”","老笑话关于不可知论技术人员建立人工超级智能来找出是否有上帝。

他们终于完成并问了这个问题。

人工智能回答：“现在有了，mfs！！”"
elonmusk,https://twitter.com/elonmusk/status/1640800519894736896,"Forgot to mention that accounts you follow directly will also be in For You, since you have explicitly asked for them",忘记提到，您直接关注的帐号也将出现在“为您推荐”中，因为您已经明确地要求这样做了。
elonmusk,https://twitter.com/elonmusk/status/1640567359307145217,"Of course, you need to have good customer service for money. 

Working on it …",当然，你需要拥有良好的客户服务才能赚钱。正在努力......
elonmusk,https://twitter.com/elonmusk/status/1640554924588277761,I’m old enough to remember https://t.co/q7uY7rhEY4,我年紀已夠大，記得https://t.co/q7uY7rhEY4
elonmusk,https://twitter.com/elonmusk/status/1640502698549075972,"Starting April 15th, only verified accounts will be eligible to be in For You recommendations.

The is the only realistic way to address advanced AI bot swarms taking over. It is otherwise a hopeless losing battle.

Voting in polls will require verification for same reason.",从4月15日开始，只有经过验证的账户才有资格进入“为您推荐”。这是应对先进的AI机器人群体控制局面的唯一现实方式，否则就是一场无望的持续失败的战斗。参与民意调查将需要经过验证，出于同样的原因。
elonmusk,https://twitter.com/elonmusk/status/1640416516075290624,The good old days https://t.co/BohnyiRj32,往日的美好时光 https://t.co/BohnyiRj32
elonmusk,https://twitter.com/elonmusk/status/1640307661123072000,"To get Blue Check Verified for $7/month, sign up via web at https://t.co/JUTlIcVsSe",要以每月7美元的价格获得蓝色检查验证，请通过https://t.co/JUTlIcVsSe网站注册。
